{
  "$schema": "https://json-schema.org/draft/2020-12/schema",
  "title": "EXP-003 candidate PROTO-003 TEST-403 vector",
  "description": "Non-normative experiment schema. A fixture matching this schema is not a reviewed SPAKE2 vector.",
  "type": "object",
  "additionalProperties": false,
  "required": ["status", "domainVersion", "bindingCanonicalJson", "bindingHash", "c", "words", "m", "n", "wBytes", "pA", "pB", "sharedElement", "transcriptHash", "k", "cA", "cB", "mailboxSecret"],
  "properties": {
    "status": { "const": "non-normative" },
    "domainVersion": { "const": "v2" },
    "bindingCanonicalJson": { "type": "string" },
    "bindingHash": { "$ref": "#/$defs/bytes32" },
    "c": { "$ref": "#/$defs/bytes16" },
    "words": { "type": "array", "items": { "type": "string" }, "minItems": 12, "maxItems": 12 },
    "m": { "$ref": "#/$defs/bytes32" },
    "n": { "$ref": "#/$defs/bytes32" },
    "wBytes": { "$ref": "#/$defs/bytes32" },
    "pA": { "$ref": "#/$defs/bytes32" },
    "pB": { "$ref": "#/$defs/bytes32" },
    "sharedElement": { "$ref": "#/$defs/bytes32" },
    "transcriptHash": { "$ref": "#/$defs/bytes32" },
    "k": { "$ref": "#/$defs/bytes32" },
    "cA": { "$ref": "#/$defs/bytes32" },
    "cB": { "$ref": "#/$defs/bytes32" },
    "mailboxSecret": { "$ref": "#/$defs/bytes16" }
  },
  "$defs": {
    "bytes16": { "type": "string", "pattern": "^[A-Za-z0-9_-]{22}$" },
    "bytes32": { "type": "string", "pattern": "^[A-Za-z0-9_-]{43}$" }
  }
}
